{
  "as_of": "2026-09-25T09:00:00Z",
  "entries": [
    {
      "kind": "other",
      "refs": [
        "pubky://kq47ts1oghjief4acyjc7q8nuut5iodyw48atubb5d9h1gmoz1no/"
      ],
      "seq": "1",
      "sha256": "d470c2bf78ebf40c4a58834e4282209f4d33eb1701cbfe4c482d7f6752b21c24",
      "uri": "pubky://kq47ts1oghjief4acyjc7q8nuut5iodyw48atubb5d9h1gmoz1no/pub/slime-example/shop.json"
    },
    {
      "kind": "other",
      "refs": [
        "pubky://kq47ts1oghjief4acyjc7q8nuut5iodyw48atubb5d9h1gmoz1no/"
      ],
      "seq": "2",
      "sha256": "99a2e249dcf6baf80b8deefe07a0851f54463b0bda5e13a0e09d5cb398d1e640",
      "uri": "pubky://kq47ts1oghjief4acyjc7q8nuut5iodyw48atubb5d9h1gmoz1no/pub/slime-example/listings/shirt-1.json"
    },
    {
      "kind": "tag",
      "label": "local-print",
      "refs": [
        "pubky://kq47ts1oghjief4acyjc7q8nuut5iodyw48atubb5d9h1gmoz1no/pub/slime-example/listings/shirt-1.json"
      ],
      "seq": "3",
      "sha256": "ea1461ba8b814b6c74c88a71de988c4a68aee4f35e66f0a3d73a3e9d915aebb9",
      "uri": "pubky://8nwd7x787d4xxy6r349npowdz136ibmmnpmyk1m8oxw6faa6oigy/pub/slime-example/tags/shop-1.json"
    },
    {
      "kind": "blob",
      "seq": "4",
      "sha256": "dc0a6bcfa8b224dadda57c997ec68bf786c1d2a6d479c958b52c12b8c0b44135",
      "uri": "pubky://kq47ts1oghjief4acyjc7q8nuut5iodyw48atubb5d9h1gmoz1no/pub/slime-example/blobs/dc0a6bcfa8b224dadda57c997ec68bf786c1d2a6d479c958b52c12b8c0b44135"
    },
    {
      "kind": "other",
      "refs": [
        "pubky://kq47ts1oghjief4acyjc7q8nuut5iodyw48atubb5d9h1gmoz1no/",
        "pubky://kq47ts1oghjief4acyjc7q8nuut5iodyw48atubb5d9h1gmoz1no/pub/slime-example/blobs/dc0a6bcfa8b224dadda57c997ec68bf786c1d2a6d479c958b52c12b8c0b44135"
      ],
      "seq": "5",
      "sha256": "f83c6058dec437d083a59df31009937129fece0f9b735c909ed64419a372d5a9",
      "uri": "pubky://kq47ts1oghjief4acyjc7q8nuut5iodyw48atubb5d9h1gmoz1no/pub/slime-example/listings/print-2.json"
    }
  ],
  "format": "slime-index/1",
  "provider": "xey9uh3brn1wrth34jruunmy5t739xew56hacergjprd9nfoc9yo",
  "scopes": [
    {
      "key": "kq47ts1oghjief4acyjc7q8nuut5iodyw48atubb5d9h1gmoz1no"
    }
  ],
  "through": "5"
}
